{
    "$schema": "http://json-schema.org/schema#",
    "properties": {
        "condition": {
            "properties": {
                "name": {
                    "type": "string"
                },
                "url": {
                    "type": "string"
                }
            },
            "required": [
                "name",
                "url"
            ],
            "type": "object"
        },
        "id": {
            "type": "integer"
        },
        "name": {
            "type": "string"
        },
        "names": {
            "items": {
                "properties": {
                    "language": {
                        "properties": {
                            "name": {
                                "type": "string"
                            },
                            "url": {
                                "type": "string"
                            }
                        },
                        "required": [
                            "name",
                            "url"
                        ],
                        "type": "object"
                    },
                    "name": {
                        "type": "string"
                    }
                },
                "required": [
                    "language",
                    "name"
                ],
                "type": "object"
            },
            "type": "array"
        }
    },
    "required": [
        "condition",
        "id",
        "name",
        "names"
    ],
    "type": "object"
}