{
    "condition": {
        "name": "season",
        "url": "http://localhost/api/v2/encounter-condition/6/"
    },
    "id": 19,
    "name": "season-autumn",
    "names": [
        {
            "language": {
                "name": "de",
                "url": "http://localhost/api/v2/language/6/"
            },
            "name": "Im Herbst"
        },
        {
            "language": {
                "name": "en",
                "url": "http://localhost/api/v2/language/9/"
            },
            "name": "During Autumn"
        }
    ]
}
